{
  "version": "1.0",
  "lastUpdated": "2026-02-21",
  "author": "<Автор>",
  "approvedBy": "<Утвърдил>",
  "scope": "<Обхват на критерия>",
  "title": "Критерий за оценяване — <Предмет / Контролно>",
  "gradingSummaryTitle": "Обща точкова система и скала",
  "gradingScaleLabel": "Скала за оценки",
  "pointsBreakdownTitle": "Разпределение на точките по типове въпроси",
  "criteriaTitle": "Критерии за оценяване",
  "criticalQuestionsTitle": "Ключови въпроси за оценяване",
  "criticalQuestions": [
    "Работоспособност: решението дава очаквания резултат за зададените входни данни.",
    "Синтаксис/компилация: кодът компилира и не съдържа синтактични грешки.",
    "Спазване на изискванията: покрити са всички подпунктове от условието.",
    "Коректност и гранични случаи: обработка на неочаквани/крайни входове.",
    "Четимост и стил: ясни имена, отстъпи, форматиране и подходящи коментари."
  ],
  "partialCreditRules": [
    {
      "appliesTo": "Кодови задачи",
      "rules": [
        "Пълен брой точки — пълна функционалност и спазени изисквания.",
        "50–75% — частично работещ код (логика правилна, но липсват някои случаи).",
        "25–49% — правилен логически подход, но значителни грешки/липсващи части.",
        "0–24% — опит, който не демонстрира работеща логика."
      ],
      "examples": []
    }
  ],
  "scoreMatrix": [],
  "sampleAnswers": {},
  "accessibilityNotes": "",
  "generalGuidelines": [],
  "criteria": [],
  "documentFormat": {
    "printLayout": "A4",
    "font": "Times New Roman, 12pt",
    "sectionsOrder": [
      "Title",
      "Metadata",
      "Grading summary",
      "Points breakdown",
      "Criteria",
      "Sample answers",
      "Policies",
      "Signatures"
    ],
    "signatureFields": [
      "Author",
      "Approved by"
    ]
  }
}
